fecha,nombreEstablecimiento,proyecto,descripcionCompra,factura,recibo,tecnico,semana,total

3/10/2024,Elmer Remberto Recinos Lopez,CORE,Viaticos del 03/04/2024 al 03/10/2024,,350,Hector Ramirez,11,1400.00
3/10/2024,Maynor Cal Cal,CORE,Viaticos del 03/04/2024 al 03/10/2024,,350,Hector Ramirez,11,1400.00
3/10/2024,Hector Noe Ramirez Ramirez,CORE,Viaticos del 03/04/2024 al 03/10/2024,,350,Hector Ramirez,11,1400.00
3/8/2024,Oficinas Vas,CORE,Por compra vas,100,,Hector Ramirez,11,1400.00
3/8/2024,David Francisco Perez Najera,CORE,Viaticos del 03/04/2024 al 03/08/2024,,250,Hector Ramirez,11,1400.00
3/2/2024,Texaco,CORE,VERSATEC Gasolina Placas: C785BNT,290,,Hector Ramirez,11,
3/5/2024,UNO,CORE,VERSATEC Gasolina Placas: C785BNT,320.03,,Hector Ramirez,11,
