fecha,nombreEstablecimiento,proyecto,descripcionCompra,factura,recibo,tecnico,semana,total

3/10/2024,Luis Fernando Guevara Segura,CORE,Viaticos del 03/04/2024 al 03/10/2024,,350,Dany Nufio,11,1466.00
3/10/2024,Felix Perez Galicio,CORE,Viaticos del 03/04/2024 al 03/10/2024,,350,Dany Nufio,11,1466.00
3/10/2024,Fredy Arnulfo Escobar Escobar,CORE,Viaticos del 03/04/2024 al 03/10/2024,,350,Dany Nufio,11,1466.00
3/10/2024,Maxi despensa teculutan,CORE,Compra de bolsas para basura,36,,Dany Nufio,11,1466.00
3/10/2024,Litegua teculutan,CORE,Envio de facturas Sede Teculutan,30,,Dany Nufio,11,1466.00
3/10/2024,Dani Jose Leon Nufio,CORE,Viaticos del 03/04/2024 al 03/10/2024,,350,Dany Nufio,11,1466.00
3/7/2024,Shell chiquimula,CORE,VERSATEC Gasolina Placas: P-520FRV,612.99,,Dany Nufio,11,
