fecha,nombreEstablecimiento,proyecto,descripcionCompra,factura,recibo,tecnico,semana,total

3/10/2024,Jihuver Alexander Chacón Rojas,CORE,Viaticos del 03/04/2024 al 03/10/2024,,350,Wilmer Perez,11,
3/10/2024,Carlos Guillermo Leonardo Polanco,CORE,Viaticos del 03/04/2024 al 03/10/2024,,350,Wilmer Perez,11,
3/10/2024,Robert Escobar Paz,CORE,Viaticos del 03/04/2024 al 03/10/2024,,350,Wilmer Perez,11,
3/10/2024,Alex Benjamin Zabaleta Lopez,CORE,Viaticos del 03/04/2024 al 03/10/2024,,350,Wilmer Perez,11,
3/4/2024,FRAGANCIAS DEL CARIBES.A.,CORE,Compra de alcohol isopropílico para sedes teculutan amates y entre ríos,260.4,,Wilmer Perez,11,
3/10/2024,LINEAS TERRESTRES GUATEMALTECASS.A.,CORE,Envio de facturas Sede Puerto Barrios,30,,Wilmer Perez,11,
3/5/2024,UNO GUATEMALAS.A.,CORE,VERSATEC Gasolina Placas: P-024FGF,372.01,,Wilmer Perez,11,
3/7/2024,QUICAFS.A.,CORE,VERSATEC Gasolina Placas: P-024FGF,390,,Wilmer Perez,11,
