fecha,nombreEstablecimiento,proyecto,descripcionCompra,factura,recibo,tecnico,semana,total

2/23/2024,Jorge Mario Ayala Morales Interstudent,CORE,Pago de internet Sede Teculutan,220,,Dany Nufio,9,1700.00
2/21/2024,JAIRO MORALES ALDANA,CORE,Por ingreso a nodo  piedra de cal,,50,Dany Nufio,9,1700.00
2/25/2024,Fredy Arnulfo Escobar Escobar,CORE,Viaticos del 02/19/2024 al 02/25/2024,,350,Dany Nufio,9,1700.00
2/25/2024,Por envío de facturas litegua,CORE,Envio de facturas Sede Teculutan,30,,Dany Nufio,9,1700.00
2/25/2024,Felix Perez Galicio,CORE,Viaticos del 02/19/2024 al 02/25/2024,,350,Dany Nufio,9,1700.00
2/25/2024,Luis Fernando Guevara Segura,CORE,Viaticos del 02/19/2024 al 02/25/2024,,350,Dany Nufio,9,1700.00
2/25/2024,Mario de Jesus Ventura Agustin,CORE,Viaticos del 02/19/2024 al 02/25/2024,,350,Dany Nufio,9,1700.00
2/20/2024,Shel estación santa cruz,CORE,VERSATEC Gasolina Sede Teculutan,570.09,,Dany Nufio,9,
