fecha,nombreEstablecimiento,proyecto,descripcionCompra,factura,recibo,tecnico,semana,total

2/25/2024,Miguel Enrique Peralta Rodriguez,CORE,Viaticos del 02/19/2024 al 02/25/2024,,350,Miguel Peralta,9,675.00
2/25/2024,Tereso Quiñonez Samayoa,CORE,Viaticos del 02/22/2024 al 02/25/2024,,200,Miguel Peralta,9,675.00
2/22/2024,Cipreses y pinos vas,CORE,Sede San Miguel Petapa,100,,Miguel Peralta,9,675.00
2/22/2024,Cipreses y pinos vas,CORE,Sede San Miguel Petapa,25,,Miguel Peralta,9,675.00
2/19/2024,Shell,CORE,VERSATEC Gasolina Sede San Miguel Petapa,350.07,,Miguel Peralta,9,
