fecha,nombreEstablecimiento,proyecto,descripcionCompra,factura,recibo,tecnico,semana,total

1/7/2024,Mario Antonio Bailon Moreira,CORE,Viaticos del 01/02/2024 al 01/07/2024,,300,Mario Bailon,2,1600.00
1/7/2024,Hector Antonio Zacarias Diaz,CORE,Viaticos del 01/01/2024 al 01/07/2024,,350,Mario Bailon,2,1600.00
1/7/2024,Regilson Santiago Perez Ramos,CORE,Viaticos del 01/03/2024 al 01/07/2024,,250,Mario Bailon,2,1600.00
1/7/2024,Jorge Alexander Posadas Marcos,CORE,Viaticos del 01/01/2024 al 01/07/2024,,350,Mario Bailon,2,1600.00
1/8/2024,Mario Antonio Bailon Moreira,CORE,Viaticos del 01/02/2024 al 01/08/2024,,350,Mario Bailon,2,1600.00
