fecha,nombreEstablecimiento,proyecto,descripcionCompra,factura,recibo,tecnico,semana,total

4/14/2024,ARTURO ANTONIO GONZÁLES LINARES,CORE,Viaticos del 04/08/2024 al 04/14/2024,,350,Guillermo Polanco,16,1400.00
4/14/2024,Carlos Guillermo Leonardo Polanco,CORE,Viaticos del 04/08/2024 al 04/14/2024,,350,Guillermo Polanco,16,1400.00
4/14/2024,JIHUVER ALEXANDER CHACÓN ROJAS,CORE,Viaticos del 04/08/2024 al 04/14/2024,,350,Guillermo Polanco,16,1400.00
4/14/2024,Robert Escobar Paz,CORE,Viaticos del 04/08/2024 al 04/14/2024,,350,Guillermo Polanco,16,1400.00
4/11/2024,UNO GUATEMALA SOCIEDAD ANONIMA,CORE,VERSATEC Gasolina Placas: P-024FGF,373.62,,Guillermo Polanco,16,
