fecha,nombreEstablecimiento,proyecto,descripcionCompra,factura,recibo,tecnico,semana,total

3/17/2024,Julio Cesar Menjivar Tovar,CORE,Viaticos del 03/11/2024 al 03/17/2024,,350,Carlos Mac,12,1017.00
3/9/2024,Guatex,CORE,Envio de facturas Sede Puerto San Jose,33,,Carlos Mac,12,1017.00
3/13/2024,Centro de servicio automotriz milemiumm,CORE,Lavado de vehiculos Sede Puerto San Jose,75,,Carlos Mac,12,1017.00
3/16/2024,Telecomunicaciones De Guatemala,CORE,Pago de internet Sede Puerto San Jose,209,,Carlos Mac,12,1017.00
3/17/2024,Carlos Humberto Mac Juc,CORE,Viaticos del 03/11/2024 al 03/17/2024,,350,Carlos Mac,12,1017.00
3/12/2024,Gasolinera uno,CORE,VERSATEC Gasolina Placas: P981KBY,250.04,,Carlos Mac,12,
