fecha,nombreEstablecimiento,proyecto,descripcionCompra,factura,recibo,tecnico,semana,total

3/3/2024,Denis Herrera,CORE,Viaticos del 02/26/2024 al 03/03/2024,,350,Denis Herrera,10,900.00
3/1/2024,Geminis-Group,CORE,Compra de luces para vehículo,150,,Denis Herrera,10,900.00
3/1/2024,Geminis-Group,CORE,Compra de luces para vehículo Jutiapa,150,,Denis Herrera,10,900.00
3/2/2024,Hot dog,CORE,Compra de alimento por tendido de fibra anti-roedor,,250,Denis Herrera,10,900.00
2/29/2024,Gasolinera Shell,CORE,VERSATEC Gasolina Placas: P-667JSF,138,,Denis Herrera,10,
3/2/2024,Gasolinera Shell,CORE,VERSATEC Gasolina Placas: P-667JSF,245.6,,Denis Herrera,10,
