fecha,nombreEstablecimiento,proyecto,descripcionCompra,factura,recibo,tecnico,semana,total

2/1/2024,Sede parramos tigo pradera chimal,CORE,Pago de Servicio de Internet,220,,Victor Chavez,10,1270.00
3/3/2024,Wilson Alexander Ramirez Mendez,CORE,Viaticos del 02/26/2024 al 03/03/2024,,350,Victor Chavez,10,1270.00
3/3/2024,Fredy Orlando Paredes Alcor,CORE,Viaticos del 02/26/2024 al 03/03/2024,,350,Victor Chavez,10,1270.00
3/3/2024,Jose Victor Chavez Lopez,CORE,Viaticos del 02/26/2024 al 03/03/2024,,350,Victor Chavez,10,1270.00
2/28/2024,Shell pradera chimaltensngo,CORE,VERSATEC Gasolina Placas: C223BVG,485,,Victor Chavez,10,
