fecha,nombreEstablecimiento,proyecto,descripcionCompra,factura,recibo,tecnico,semana,total

3/3/2024,Tereso Quiñonez Samayoa,CORE,Viaticos del 02/26/2024 al 03/03/2024,,350,Miguel Peralta,10,800.00
3/1/2024,Miguel Enrique Peralta Rodriguez,CORE,Viaticos del 02/26/2024 al 03/01/2024,,250,Miguel Peralta,10,800.00
3/1/2024,Municipalidad de San Miguel Petapa,CORE,Pago de Agua Sede San Miguel Petapa,100,,Miguel Peralta,10,800.00
3/1/2024,Residencial Rivera del río,CORE,Pago de mantenimiento Sede San Miguel Petapa,100,,Miguel Peralta,10,800.00
2/25/2024,Texaco turin,CORE,VERSATEC Gasolina Placas: P921fyx,340,,Miguel Peralta,10,
